{
  "transportMode": "backend",
  "apiBaseUrl": "https://api.example.com",
  "contractDefinitionUrl": "https://api.example.com/.well-known/command-center/connection-contract",
  "openApiUrl": "https://api.example.com/openapi.json",
  "configValues": {},
  "compiledContract": {
    "contractVersion": 1,
    "adapter": {
      "type": "adapter-from-api",
      "id": "orders-api",
      "title": "Orders API",
      "description": "Orders API contract."
    },
    "openapi": {
      "url": "https://api.example.com/openapi.json"
    },
    "configVariables": [],
    "secretVariables": [],
    "availableOperations": [
      {
        "operationId": "listOrders",
        "method": "GET",
        "path": "/v1/orders",
        "kind": "query",
        "capabilities": ["query"],
        "responseContract": "core.tabular_frame@v1"
      }
    ],
    "health": {
      "operationId": "listOrders"
    }
  },
  "compiledContractSource": "backend",
  "compiledContractSourceUrl": "https://api.example.com/.well-known/command-center/connection-contract"
}
